{
 "schema_version": 1,
 "description": "Recorded Figma REST responses for an award-packages design.",
 "figma_url": "https://www.figma.com/design/AbCdEfGhIjKlMnOp1234/Award-packages",
 "responses": [
  {
   "url": "https://api.figma.com/v1/files/AbCdEfGhIjKlMnOp1234?depth=2",
   "status": 200,
   "body_json": {
    "document": {
     "id": "0:0",
     "name": "Document",
     "type": "DOCUMENT",
     "children": [
      {
       "id": "0:1",
       "name": "Packages",
       "type": "CANVAS",
       "children": [
        {
         "id": "1:2",
         "name": "Packages / List",
         "type": "FRAME"
        },
        {
         "id": "1:3",
         "name": "Packages / Details",
         "type": "FRAME"
        },
        {
         "id": "1:4",
         "name": "Packages / Awarded",
         "type": "FRAME"
        }
       ]
      }
     ]
    },
    "name": "Award packages",
    "version": "1"
   }
  },
  {
   "url": "https://api.figma.com/v1/files/AbCdEfGhIjKlMnOp1234/nodes?ids=1%3A2%2C1%3A3%2C1%3A4",
   "status": 200,
   "body_json": {
    "nodes": {
     "1:2": {
      "document": {
       "id": "1:2",
       "name": "Packages / List",
       "type": "FRAME",
       "children": [
        {
         "id": "1:21",
         "name": "Title",
         "type": "TEXT",
         "characters": "Supplier packages",
         "absoluteBoundingBox": {
          "x": 0,
          "y": 0,
          "width": 100,
          "height": 20
         }
        },
        {
         "id": "1:22",
         "name": "Row 1",
         "type": "TEXT",
         "characters": "PKG-104 Kitchen refit · Acme Joinery · £12,400 · Open",
         "absoluteBoundingBox": {
          "x": 0,
          "y": 0,
          "width": 100,
          "height": 20
         }
        },
        {
         "id": "1:23",
         "name": "Button / View details",
         "type": "INSTANCE",
         "componentId": "9:1",
         "children": [
          {
           "id": "1:231",
           "name": "Label",
           "type": "TEXT",
           "characters": "View details",
           "absoluteBoundingBox": {
            "x": 0,
            "y": 0,
            "width": 100,
            "height": 20
           }
          }
         ],
         "reactions": [
          {
           "trigger": {
            "type": "ON_CLICK"
           },
           "actions": [
            {
             "type": "NODE",
             "destinationId": "1:3",
             "navigation": "NAVIGATE"
            }
           ]
          }
         ]
        }
       ]
      }
     },
     "1:3": {
      "document": {
       "id": "1:3",
       "name": "Packages / Details",
       "type": "FRAME",
       "children": [
        {
         "id": "1:31",
         "name": "Title",
         "type": "TEXT",
         "characters": "PKG-104 Kitchen refit",
         "absoluteBoundingBox": {
          "x": 0,
          "y": 0,
          "width": 100,
          "height": 20
         }
        },
        {
         "id": "1:32",
         "name": "Supplier",
         "type": "TEXT",
         "characters": "Supplier: Acme Joinery",
         "absoluteBoundingBox": {
          "x": 0,
          "y": 0,
          "width": 100,
          "height": 20
         }
        },
        {
         "id": "1:33",
         "name": "Button / Award Package",
         "type": "INSTANCE",
         "componentId": "9:1",
         "children": [
          {
           "id": "1:331",
           "name": "Label",
           "type": "TEXT",
           "characters": "Award Package",
           "absoluteBoundingBox": {
            "x": 0,
            "y": 0,
            "width": 100,
            "height": 20
           }
          }
         ],
         "reactions": [
          {
           "trigger": {
            "type": "ON_CLICK"
           },
           "actions": [
            {
             "type": "NODE",
             "destinationId": "1:4",
             "navigation": "NAVIGATE"
            }
           ]
          }
         ]
        },
        {
         "id": "1:34",
         "name": "Button / Back",
         "type": "INSTANCE",
         "componentId": "9:1",
         "children": [
          {
           "id": "1:341",
           "name": "Label",
           "type": "TEXT",
           "characters": "Back",
           "absoluteBoundingBox": {
            "x": 0,
            "y": 0,
            "width": 100,
            "height": 20
           }
          }
         ],
         "reactions": [
          {
           "trigger": {
            "type": "ON_CLICK"
           },
           "actions": [
            {
             "type": "NODE",
             "destinationId": "1:2",
             "navigation": "NAVIGATE"
            }
           ]
          }
         ]
        }
       ]
      }
     },
     "1:4": {
      "document": {
       "id": "1:4",
       "name": "Packages / Awarded",
       "type": "FRAME",
       "children": [
        {
         "id": "1:41",
         "name": "Banner",
         "type": "TEXT",
         "characters": "Package awarded to Acme Joinery",
         "absoluteBoundingBox": {
          "x": 0,
          "y": 0,
          "width": 100,
          "height": 20
         }
        },
        {
         "id": "1:42",
         "name": "Button / Award Package (disabled)",
         "type": "INSTANCE",
         "componentId": "9:1",
         "children": [
          {
           "id": "1:421",
           "name": "Label",
           "type": "TEXT",
           "characters": "Award Package",
           "absoluteBoundingBox": {
            "x": 0,
            "y": 0,
            "width": 100,
            "height": 20
           }
          }
         ]
        }
       ]
      }
     }
    }
   }
  },
  {
   "url": "https://figma-alpha-api.s3.us-west-2.amazonaws.com/images/frame-1-2.png",
   "status": 200,
   "headers": {
    "content-type": "image/png"
   },
   "body_file": "frame-1-2.png"
  },
  {
   "url": "https://figma-alpha-api.s3.us-west-2.amazonaws.com/images/frame-1-3.png",
   "status": 200,
   "headers": {
    "content-type": "image/png"
   },
   "body_file": "frame-1-3.png"
  },
  {
   "url": "https://figma-alpha-api.s3.us-west-2.amazonaws.com/images/frame-1-4.png",
   "status": 200,
   "headers": {
    "content-type": "image/png"
   },
   "body_file": "frame-1-4.png"
  },
  {
   "url": "https://api.figma.com/v1/images/AbCdEfGhIjKlMnOp1234?ids=1%3A2%2C1%3A3%2C1%3A4&format=png&scale=1",
   "status": 200,
   "body_json": {
    "err": null,
    "images": {
     "1:2": "https://figma-alpha-api.s3.us-west-2.amazonaws.com/images/frame-1-2.png",
     "1:3": "https://figma-alpha-api.s3.us-west-2.amazonaws.com/images/frame-1-3.png",
     "1:4": "https://figma-alpha-api.s3.us-west-2.amazonaws.com/images/frame-1-4.png"
    }
   }
  }
 ]
}
